{
"name": "Special",
"version": "1.0.1",
"description": "Control flow activities: loops, conditionals, parallel execution, timers, and diagnostics.",
"authors": [ "OutWit" ],
"copyright": "Copyright 2025 OutWit",
"projectUrl": "",
"repositoryUrl": "",
"license": "MIT",
"tags": [ "control-flow", "loops", "parallel", "diagnostics" ],
"features": [ "if", "loop", "foreach", "parallel-foreach", "parallel-invoke", "timer", "trace", "delayed" ],
"useCases": [ "Workflow control flow", "Parallel processing", "Diagnostics" ],
"runtimeTargets": [  ],
"dependencies": { "Variables": "1.0.0" }
}
