{
"name": "Matrices",
"version": "1.0.1",
"description": "Matrix and vector operations including sparse representations and Gustavson multiplication.",
"authors": [ "OutWit" ],
"copyright": "Copyright 2025 OutWit",
"projectUrl": "",
"repositoryUrl": "",
"license": "MIT",
"tags": [ "matrices", "vectors", "linear-algebra", "sparse" ],
"features": [ "dense-matrix", "sparse-matrix", "dense-vector", "sparse-vector", "gustavson-multiply" ],
"useCases": [ "Linear algebra", "Sparse matrix multiplication", "Scientific computing" ],
"runtimeTargets": [  ],
"dependencies": {  }
}
